{
  "format": "hyper-deployment-authorization-state",
  "format_version": 1,
  "generation": 1,
  "device_id": "10000000-0000-4000-8000-000000000001",
  "device_public_key": {
    "kty": "OKP",
    "crv": "Ed25519",
    "x": "AAAAAAAAAAAAAAAAAAAAAAAAAAAAAAAAAAAAAAAAAAA"
  },
  "policy": {
    "max_paired_clients": 4,
    "max_recent_requests": 64,
    "max_audit_events": 256,
    "max_request_lifetime_ms": 300000,
    "max_clock_skew_ms": 30000,
    "max_bundle_bytes": 1073741824
  },
  "pending_pairing_challenge": null,
  "clients": [],
  "recent_requests": [],
  "audit_sequence": 0,
  "audit_events": [],
  "extensions": {}
}
